<?xml version="1.0" encoding="UTF-8"?>
<root xmlns:xsi="http://www.w3.org/2001/XMLSchema-instance" xsi:noNamespaceSchemaLocation="../config.xsd">
  <screen name="CardMaster">
    <htmltemplate></htmltemplate>
    <includedjsp></includedjsp>
    <callbackclass></callbackclass>
    <scripts>
      <scriptinclude></scriptinclude>
    </scripts>
    <stylesheets>
      <styleinclude></styleinclude>
    </stylesheets>
    <sessionvars>sessionvars</sessionvars>
    <crud>
	   <jsonrpc outstack="formonload" id="onloadqry1">SELECT CARD_NO "cardno",CIN "cin",CARD_STATUS "cardstatus" FROM CARD_MASTER 
			<countquery pagesize="10">select count('x') from CARD_MASTER </countquery>
	   </jsonrpc>
       <jsonrpc outstack="formpagination" id="gridonload">SELECT CARD_NO "cardno",CIN "cin",CARD_STATUS "cardstatus" FROM CARD_MASTER 
			<countquery pagesize="10">select count('x') from CARD_MASTER </countquery>
	   </jsonrpc>
<!--NORMAL SQLs
      <sqlinsert id="frmnrmladd" outstack="inst">insert into CARD_MASTER( CARD_NO, CIN, CARD_STATUS) values ( #inp.form1[0].CARD_NO, #inp.form1[0].CIN, #inp.form1[0].CARD_STATUS)</sqlinsert>
      <sqldelete id="frmnrmldel" outstack="delt">delete from CARD_MASTER WHERE CARD_NO = #inp.form1[0].CARD_NO</sqldelete>
      <sqlupdate id="frmnrmledit" outstack="updt">update CARD_MASTER set  CIN = #inp.form1[0].CIN, CARD_STATUS = #inp.form1[0].CARD_STATUS WHERE CARD_NO=#inp.form1[0].CARD_NO<message message="Record(s) got updated." /><error message="Record(s) update failed." /></sqlupdate>
-->
<!--GRID INSERTS (check out which alias is required-->
      <sqlinsert id="frmgridadd"  outstack="inst">insert into CARD_MASTER( CARD_NO, CIN, CARD_STATUS) values ( #inp.form1[0].cardno, #inp.form1[0].cin, #inp.form1[0].cardstatus )</sqlinsert>
      <sqlinsert id="gridadd"     outstack="inst">insert into CARD_MASTER( CARD_NO, CIN, CARD_STATUS) values ( #inp.form1[0].cardno, #inp.form1[0].cin, #inp.form1[0].cardstatus )</sqlinsert>
      <sqldelete id="frmgriddel"  outstack="delt">delete from CARD_MASTER WHERE CARD_NO = #inp.form1[0].cardno|STRING</sqldelete>
      <sqldelete id="griddel"     outstack="delt">delete from CARD_MASTER WHERE CARD_NO = #inp.form1[0].id|STRING</sqldelete>
      <sqlupdate id="frmgridedit" outstack="updt">update CARD_MASTER set  CIN = #inp.form1[0].cin, CARD_STATUS = #inp.form1[0].cardstatus WHERE CARD_NO=#inp.form1[0].cardno <error message="Record(s) update failed." /><message message="Record(s) got updated." /></sqlupdate>
      <sqlupdate id="gridedit"    outstack="updt">update CARD_MASTER set  CIN = #inp.form1[0].cin, CARD_STATUS = #inp.form1[0].cardstatus WHERE CARD_NO=#inp.form1[0].id|STRING <error message="Record(s) update failed." /><message message="Record(s) got updated." /></sqlupdate>
    </crud>
    <dm>
      <txnproc id="" outstack=""/>
    </dm>
    <bl id="">
      <buslogic id="" method=""/>
    </bl>
    <anyprocs>
      <proc id="" outstack=""/>
    </anyprocs>
    <commands>
      <cmd instack="" name="" opt=""  result="" />
      <bulkcmd name="fromViewTransition" opt="" result="ajax" resultScrName="CardMaster" />
      <bulkcmd name="frmgridadd" opt="sqlinsert:frmgridadd" result="ajax" resultScrName="CardMaster"/>
      <bulkcmd name="frmgridedit" opt="sqlupdate:frmgridedit" result="ajax"/>
      <bulkcmd name="frmgriddel" opt="sqldelete:frmgriddel" result="ajax"/>
      <bulkcmd name="griddel" opt="sqldelete:griddel" result="ajax"/>
      <bulkcmd name="gridedit" opt="sqlupdate:gridedit" result="ajax"/>
      <bulkcmd name="gridadd" opt="sqlinsert:gridadd" result="ajax"/>
      <bulkcmd name="gridonload" opt="jsonrpc:gridonload" result="ajax"/>
      <onload opt="jsonrpc:onloadqry1" result="/jsptest/CardMaster.jsp"/>
    </commands>
  </screen>
  <panels>
    <panel id="">
       <fields>
          <field>
          	<validationfld dbcolsize="25" name="cardno" column="CARD_NO" mandatory="no" forid="cardno" dbdatatype="STRING" />
          	<validationfld dbcolsize="100" name="cin" column="CIN" mandatory="no" forid="cin" dbdatatype="STRING" />
          	<validationfld dbcolsize="2" name="cardstatus" column="CARD_STATUS" mandatory="no" forid="cardstatus" dbdatatype="STRING" />

          	<label replace="modify" key="cardno" value="Card No" forname="cardno"/>
          	<label replace="modify" key="cin" value="Cin" forname="cin"/>
          	<label replace="modify" key="cardstatus" value="Card Status" forname="cardstatus"/>

          </field>
       </fields>
      <button forid="" id="" onclick="" replace="modify" type="">button</button>
    </panel>
  </panels>
</root>

