<?xml version="1.0" encoding="UTF-8"?>
<root xmlns:xsi="http://www.w3.org/2001/XMLSchema-instance" xsi:noNamespaceSchemaLocation="../config.xsd">
  <screen name="CustomerMaster">
    <htmltemplate></htmltemplate>
    <includedjsp></includedjsp>
    <callbackclass></callbackclass>
    <scripts>
      <scriptinclude></scriptinclude>
    </scripts>
    <stylesheets>
      <styleinclude></styleinclude>
    </stylesheets>
    <sessionvars>sessionvars</sessionvars>
    <crud>
	   <jsonrpc outstack="formonload" id="onloadqry1">SELECT CIN "cin",NRIC "nric",F_NAME "fname",L_NAME "lname",EMAIL_ID "emailid",MOBILE_NO "mobileno" FROM CUSTOMER_MASTER 
			<countquery pagesize="10">select count('x') from CUSTOMER_MASTER </countquery>
	   </jsonrpc>
       <jsonrpc outstack="formpagination" id="gridonload">SELECT CIN "cin",NRIC "nric",F_NAME "fname",L_NAME "lname",EMAIL_ID "emailid",MOBILE_NO "mobileno" FROM CUSTOMER_MASTER 
			<countquery pagesize="10">select count('x') from CUSTOMER_MASTER </countquery>
	   </jsonrpc>
<!--NORMAL SQLs
      <sqlinsert id="frmnrmladd" outstack="inst">insert into CUSTOMER_MASTER( CIN, NRIC, F_NAME, L_NAME, EMAIL_ID, MOBILE_NO) values ( #inp.form1[0].CIN, #inp.form1[0].NRIC, #inp.form1[0].F_NAME, #inp.form1[0].L_NAME, #inp.form1[0].EMAIL_ID, #inp.form1[0].MOBILE_NO)</sqlinsert>
      <sqldelete id="frmnrmldel" outstack="delt">delete from CUSTOMER_MASTER WHERE CIN = #inp.form1[0].CIN</sqldelete>
      <sqlupdate id="frmnrmledit" outstack="updt">update CUSTOMER_MASTER set  NRIC = #inp.form1[0].NRIC, F_NAME = #inp.form1[0].F_NAME, L_NAME = #inp.form1[0].L_NAME, EMAIL_ID = #inp.form1[0].EMAIL_ID, MOBILE_NO = #inp.form1[0].MOBILE_NO WHERE CIN=#inp.form1[0].CIN<message message="Record(s) got updated." /><error message="Record(s) update failed." /></sqlupdate>
-->
<!--GRID INSERTS (check out which alias is required-->
      <sqlinsert id="frmgridadd"  outstack="inst">insert into CUSTOMER_MASTER( CIN, NRIC, F_NAME, L_NAME, EMAIL_ID, MOBILE_NO) values ( #inp.form1[0].cin, #inp.form1[0].nric, #inp.form1[0].fname, #inp.form1[0].lname, #inp.form1[0].emailid, #inp.form1[0].mobileno )</sqlinsert>
      <sqlinsert id="gridadd"     outstack="inst">insert into CUSTOMER_MASTER( CIN, NRIC, F_NAME, L_NAME, EMAIL_ID, MOBILE_NO) values ( #inp.form1[0].cin, #inp.form1[0].nric, #inp.form1[0].fname, #inp.form1[0].lname, #inp.form1[0].emailid, #inp.form1[0].mobileno )</sqlinsert>
      <sqldelete id="frmgriddel"  outstack="delt">delete from CUSTOMER_MASTER WHERE CIN = #inp.form1[0].cin|STRING</sqldelete>
      <sqldelete id="griddel"     outstack="delt">delete from CUSTOMER_MASTER WHERE CIN = #inp.form1[0].id|STRING</sqldelete>
      <sqlupdate id="frmgridedit" outstack="updt">update CUSTOMER_MASTER set  NRIC = #inp.form1[0].nric, F_NAME = #inp.form1[0].fname, L_NAME = #inp.form1[0].lname, EMAIL_ID = #inp.form1[0].emailid, MOBILE_NO = #inp.form1[0].mobileno WHERE CIN=#inp.form1[0].cin <error message="Record(s) update failed." /><message message="Record(s) got updated." /></sqlupdate>
      <sqlupdate id="gridedit"    outstack="updt">update CUSTOMER_MASTER set  NRIC = #inp.form1[0].nric, F_NAME = #inp.form1[0].fname, L_NAME = #inp.form1[0].lname, EMAIL_ID = #inp.form1[0].emailid, MOBILE_NO = #inp.form1[0].mobileno WHERE CIN=#inp.form1[0].id|STRING <error message="Record(s) update failed." /><message message="Record(s) got updated." /></sqlupdate>
    </crud>
    <dm>
      <txnproc id="" outstack=""/>
    </dm>
    <bl id="">
      <buslogic id="" method=""/>
    </bl>
    <anyprocs>
      <proc id="" outstack=""/>
    </anyprocs>
    <commands>
      <cmd instack="" name="" opt=""  result="" />
      <bulkcmd name="fromViewTransition" opt="" result="ajax" resultScrName="CustomerMaster" />
      <bulkcmd name="frmgridadd" opt="sqlinsert:frmgridadd" result="ajax" resultScrName="CustomerMaster"/>
      <bulkcmd name="frmgridedit" opt="sqlupdate:frmgridedit" result="ajax"/>
      <bulkcmd name="frmgriddel" opt="sqldelete:frmgriddel" result="ajax"/>
      <bulkcmd name="griddel" opt="sqldelete:griddel" result="ajax"/>
      <bulkcmd name="gridedit" opt="sqlupdate:gridedit" result="ajax"/>
      <bulkcmd name="gridadd" opt="sqlinsert:gridadd" result="ajax"/>
      <bulkcmd name="gridonload" opt="jsonrpc:gridonload" result="ajax"/>
      <onload opt="jsonrpc:onloadqry1" result="/jsptest/CustomerMaster.jsp"/>
    </commands>
  </screen>
  <panels>
    <panel id="">
       <fields>
          <field>
          	<validationfld dbcolsize="16" name="cin" column="CIN" mandatory="no" forid="cin" dbdatatype="STRING" />
          	<validationfld dbcolsize="20" name="nric" column="NRIC" mandatory="no" forid="nric" dbdatatype="STRING" />
          	<validationfld dbcolsize="50" name="fname" column="F_NAME" mandatory="no" forid="fname" dbdatatype="STRING" />
          	<validationfld dbcolsize="50" name="lname" column="L_NAME" mandatory="no" forid="lname" dbdatatype="STRING" />
          	<validationfld dbcolsize="50" name="emailid" column="EMAIL_ID" mandatory="no" forid="emailid" dbdatatype="STRING" />
          	<validationfld dbcolsize="25" name="mobileno" column="MOBILE_NO" mandatory="no" forid="mobileno" dbdatatype="STRING" />

          	<label replace="modify" key="cin" value="Cin" forname="cin"/>
          	<label replace="modify" key="nric" value="Nric" forname="nric"/>
          	<label replace="modify" key="fname" value="F Name" forname="fname"/>
          	<label replace="modify" key="lname" value="L Name" forname="lname"/>
          	<label replace="modify" key="emailid" value="Email Id" forname="emailid"/>
          	<label replace="modify" key="mobileno" value="Mobile No" forname="mobileno"/>

          </field>
       </fields>
      <button forid="" id="" onclick="" replace="modify" type="">button</button>
    </panel>
  </panels>
</root>

