<?xml version="1.0" encoding="UTF-8"?>
<root xmlns:xsi="http://www.w3.org/2001/XMLSchema-instance" xsi:noNamespaceSchemaLocation="../config.xsd">
  <screen name="PassionUserTemp">
    <htmltemplate></htmltemplate>
    <includedjsp></includedjsp>
    <callbackclass></callbackclass>
    <scripts>
      <scriptinclude></scriptinclude>
    </scripts>
    <stylesheets>
      <styleinclude></styleinclude>
    </stylesheets>
    <sessionvars>sessionvars</sessionvars>
    <crud>
	   <jsonrpc outstack="formonload" id="onloadqry1">SELECT CARD_NO "cardno",ID_VALUE "idvalue",ID_TYPE "idtype",ACTION_FLAG "actionflag",VALID_CARD "validcard",ALREADY_REGISTERED "alreadyregistered",REGISTRATION_COMPLETED "registrationcompleted",INPUT_FILE_NAME "inputfilename",RETURN_FILE_CREATED "returnfilecreated",ERROR_CODE "errorcode",FILE_PROCESSED_FLAG "fileprocessedflag",NATIONALITY "nationality",ERROR_MSG "errormsg" FROM PASSION_USER_TEMP 
			<countquery pagesize="10">select count('x') from PASSION_USER_TEMP </countquery>
	   </jsonrpc>
       <jsonrpc outstack="formpagination" id="gridonload">SELECT CARD_NO "cardno",ID_VALUE "idvalue",ID_TYPE "idtype",ACTION_FLAG "actionflag",VALID_CARD "validcard",ALREADY_REGISTERED "alreadyregistered",REGISTRATION_COMPLETED "registrationcompleted",INPUT_FILE_NAME "inputfilename",RETURN_FILE_CREATED "returnfilecreated",ERROR_CODE "errorcode",FILE_PROCESSED_FLAG "fileprocessedflag",NATIONALITY "nationality",ERROR_MSG "errormsg" FROM PASSION_USER_TEMP 
			<countquery pagesize="10">select count('x') from PASSION_USER_TEMP </countquery>
	   </jsonrpc>
<!--GRID INSERTS (check out which alias is required-->
      <sqlinsert id="frmgridadd" outstack="inst">insert into PASSION_USER_TEMP( CARD_NO, ID_VALUE, ID_TYPE, ACTION_FLAG, VALID_CARD, ALREADY_REGISTERED, REGISTRATION_COMPLETED, INPUT_FILE_NAME, RETURN_FILE_CREATED, ERROR_CODE, FILE_PROCESSED_FLAG, NATIONALITY, ERROR_MSG) values ( #inp.form1[0].CARD_NO, #inp.form1[0].ID_VALUE, #inp.form1[0].ID_TYPE, #inp.form1[0].ACTION_FLAG, #inp.form1[0].VALID_CARD, #inp.form1[0].ALREADY_REGISTERED, #inp.form1[0].REGISTRATION_COMPLETED, #inp.form1[0].INPUT_FILE_NAME, #inp.form1[0].RETURN_FILE_CREATED, #inp.form1[0].ERROR_CODE, #inp.form1[0].FILE_PROCESSED_FLAG, #inp.form1[0].NATIONALITY, #inp.form1[0].ERROR_MSG )</sqlinsert>
      <sqlinsert id="gridadd" outstack="inst">insert into PASSION_USER_TEMP( CARD_NO, ID_VALUE, ID_TYPE, ACTION_FLAG, VALID_CARD, ALREADY_REGISTERED, REGISTRATION_COMPLETED, INPUT_FILE_NAME, RETURN_FILE_CREATED, ERROR_CODE, FILE_PROCESSED_FLAG, NATIONALITY, ERROR_MSG) values ( #inp.form1[0].CARD_NO, #inp.form1[0].ID_VALUE, #inp.form1[0].ID_TYPE, #inp.form1[0].ACTION_FLAG, #inp.form1[0].VALID_CARD, #inp.form1[0].ALREADY_REGISTERED, #inp.form1[0].REGISTRATION_COMPLETED, #inp.form1[0].INPUT_FILE_NAME, #inp.form1[0].RETURN_FILE_CREATED, #inp.form1[0].ERROR_CODE, #inp.form1[0].FILE_PROCESSED_FLAG, #inp.form1[0].NATIONALITY, #inp.form1[0].ERROR_MSG )</sqlinsert>
      <sqldelete id="frmgriddel" outstack="delt">delete from PASSION_USER_TEMP WHERE CARD_NO = #inp.form1[0].CARD_NO|STRING</sqldelete>
      <sqldelete id="griddel" outstack="delt">delete from PASSION_USER_TEMP WHERE CARD_NO = #inp.form1[0].id|STRING</sqldelete>
      <sqlupdate id="frmgridedit" outstack="updt">update PASSION_USER_TEMP set  ID_VALUE = #inp.form1[0].ID_VALUE, ID_TYPE = #inp.form1[0].ID_TYPE, ACTION_FLAG = #inp.form1[0].ACTION_FLAG, VALID_CARD = #inp.form1[0].VALID_CARD, ALREADY_REGISTERED = #inp.form1[0].ALREADY_REGISTERED, REGISTRATION_COMPLETED = #inp.form1[0].REGISTRATION_COMPLETED, INPUT_FILE_NAME = #inp.form1[0].INPUT_FILE_NAME, RETURN_FILE_CREATED = #inp.form1[0].RETURN_FILE_CREATED, ERROR_CODE = #inp.form1[0].ERROR_CODE, FILE_PROCESSED_FLAG = #inp.form1[0].FILE_PROCESSED_FLAG, NATIONALITY = #inp.form1[0].NATIONALITY, ERROR_MSG = #inp.form1[0].ERROR_MSG WHERE CARD_NO=#inp.form1[0].CARD_NO</sqlupdate>
      <sqlupdate id="gridedit" outstack="updt">update PASSION_USER_TEMP set  ID_VALUE = #inp.form1[0].ID_VALUE, ID_TYPE = #inp.form1[0].ID_TYPE, ACTION_FLAG = #inp.form1[0].ACTION_FLAG, VALID_CARD = #inp.form1[0].VALID_CARD, ALREADY_REGISTERED = #inp.form1[0].ALREADY_REGISTERED, REGISTRATION_COMPLETED = #inp.form1[0].REGISTRATION_COMPLETED, INPUT_FILE_NAME = #inp.form1[0].INPUT_FILE_NAME, RETURN_FILE_CREATED = #inp.form1[0].RETURN_FILE_CREATED, ERROR_CODE = #inp.form1[0].ERROR_CODE, FILE_PROCESSED_FLAG = #inp.form1[0].FILE_PROCESSED_FLAG, NATIONALITY = #inp.form1[0].NATIONALITY, ERROR_MSG = #inp.form1[0].ERROR_MSG WHERE CARD_NO=#inp.form1[0].id|STRING</sqlupdate>
    </crud>
    <dm>
      <txnproc id="" outstack=""/>
    </dm>
    <bl id="">
      <buslogic id="" method=""/>
    </bl>
    <anyprocs>
      <proc id="" outstack=""/>
    </anyprocs>
    <commands>
      <cmd instack="" name="" opt=""  result="" />
      <bulkcmd name="fromViewTransition" opt="" result="ajax" resultScrName="PassionUserTemp" />
      <bulkcmd name="frmgridadd" opt="sqlinsert:frmgridadd" result="ajax" resultScrName="PassionUserTemp"/>
      <bulkcmd name="frmgridedit" opt="sqlupdate:frmgridedit" result="ajax"/>
      <bulkcmd name="frmgriddel" opt="sqldelete:frmgriddel" result="ajax"/>
      <bulkcmd name="griddel" opt="sqldelete:griddel" result="ajax"/>
      <bulkcmd name="gridedit" opt="sqlupdate:gridedit" result="ajax"/>
      <bulkcmd name="gridadd" opt="sqlinsert:gridadd" result="ajax"/>
      <bulkcmd name="gridonload" opt="jsonrpc:gridonload" result="ajax"/>
      <onload opt="jsonrpc:onloadqry1" result="/jsptest/PassionUserTemp.jsp"/>
    </commands>
  </screen>
  <panels>
    <panel id="">
       <fields>
          <field>
          	<validationfld dbcolsize="16" name="cardno" column="CARD_NO" mandatory="yes" forid="cardno" dbdatatype="STRING" />
          	<validationfld dbcolsize="25" name="idvalue" column="ID_VALUE" mandatory="yes" forid="idvalue" dbdatatype="STRING" />
          	<validationfld dbcolsize="10" name="idtype" column="ID_TYPE" mandatory="yes" forid="idtype" dbdatatype="STRING" />
          	<validationfld dbcolsize="20" name="actionflag" column="ACTION_FLAG" mandatory="yes" forid="actionflag" dbdatatype="STRING" />
          	<validationfld dbcolsize="1" name="validcard" column="VALID_CARD" mandatory="yes" forid="validcard" dbdatatype="STRING" />
          	<validationfld dbcolsize="1" name="alreadyregistered" column="ALREADY_REGISTERED" mandatory="yes" forid="alreadyregistered" dbdatatype="STRING" />
          	<validationfld dbcolsize="1" name="registrationcompleted" column="REGISTRATION_COMPLETED" mandatory="yes" forid="registrationcompleted" dbdatatype="STRING" />
          	<validationfld dbcolsize="100" name="inputfilename" column="INPUT_FILE_NAME" mandatory="yes" forid="inputfilename" dbdatatype="STRING" />
          	<validationfld dbcolsize="1" name="returnfilecreated" column="RETURN_FILE_CREATED" mandatory="yes" forid="returnfilecreated" dbdatatype="STRING" />
          	<validationfld dbcolsize="10" name="errorcode" column="ERROR_CODE" mandatory="yes" forid="errorcode" dbdatatype="STRING" />
          	<validationfld dbcolsize="1" name="fileprocessedflag" column="FILE_PROCESSED_FLAG" mandatory="yes" forid="fileprocessedflag" dbdatatype="STRING" />
          	<validationfld dbcolsize="5" name="nationality" column="NATIONALITY" mandatory="yes" forid="nationality" dbdatatype="STRING" />
          	<validationfld dbcolsize="30" name="errormsg" column="ERROR_MSG" mandatory="yes" forid="errormsg" dbdatatype="STRING" />

          	<label replace="modify" key="cardno" value="Card No" forname="cardno"/>
          	<label replace="modify" key="idvalue" value="Id Value" forname="idvalue"/>
          	<label replace="modify" key="idtype" value="Id Type" forname="idtype"/>
          	<label replace="modify" key="actionflag" value="Action Flag" forname="actionflag"/>
          	<label replace="modify" key="validcard" value="Valid Card" forname="validcard"/>
          	<label replace="modify" key="alreadyregistered" value="Already Registered" forname="alreadyregistered"/>
          	<label replace="modify" key="registrationcompleted" value="Registration Completed" forname="registrationcompleted"/>
          	<label replace="modify" key="inputfilename" value="Input File Name" forname="inputfilename"/>
          	<label replace="modify" key="returnfilecreated" value="Return File Created" forname="returnfilecreated"/>
          	<label replace="modify" key="errorcode" value="Error Code" forname="errorcode"/>
          	<label replace="modify" key="fileprocessedflag" value="File Processed Flag" forname="fileprocessedflag"/>
          	<label replace="modify" key="nationality" value="Nationality" forname="nationality"/>
          	<label replace="modify" key="errormsg" value="Error Msg" forname="errormsg"/>

          </field>
       </fields>
      <button forid="" id="" onclick="" replace="modify" type="">button</button>
    </panel>
  </panels>
</root>